{
  "id": "stag-hunt",
  "title": "Stag Hunt",
  "description": "A coordination game where hunters must cooperate to catch a stag, or safely hunt hares alone.",
  "players": ["Hunter 1", "Hunter 2"],
  "tags": ["strategic-form", "2-player", "coordination", "classic"],
  "game_nfg": {
    "strategies": [["Stag", "Hare"], ["Stag", "Hare"]],
    "payoffs": [
      [[4.0, 4.0], [0.0, 3.0]],
      [[3.0, 0.0], [3.0, 3.0]]
    ]
  }
}
