{
  "id": "trust-game",
  "title": "Trust Game",
  "description": "A sequential game where Alice decides whether to trust Bob, who can then honor or betray that trust.",
  "players": ["Alice", "Bob"],
  "tags": ["sequential", "2-player", "example"],
  "game_efg": {
    "root": "n_start",
    "nodes": {
      "n_start": {
        "id": "n_start",
        "player": "Alice",
        "actions": [
          {"label": "Trust", "target": "n_bob"},
          {"label": "Don't", "target": "o_decline"}
        ]
      },
      "n_bob": {
        "id": "n_bob",
        "player": "Bob",
        "actions": [
          {"label": "Honor", "target": "o_coop"},
          {"label": "Betray", "target": "o_betray", "warning": "Dominated by Honor"}
        ]
      }
    },
    "outcomes": {
      "o_coop": {"label": "Cooperate", "payoffs": {"Alice": 1, "Bob": 1}},
      "o_betray": {"label": "Betray", "payoffs": {"Alice": -1, "Bob": 2}},
      "o_decline": {"label": "Decline", "payoffs": {"Alice": 0, "Bob": 0}}
    }
  }
}
